{
  "$schema": "https://json-schema.org/draft/2020-12/schema",
  "$id": "https://github.com/zhora87/bezmen/locale-packs/schema.json",
  "title": "Bezmen locale pack",
  "description": "Everything that varies between countries and store chains on price tags. Mirrors LocalePack in core/domain.",
  "type": "object",
  "additionalProperties": false,
  "required": [
    "id",
    "version",
    "script",
    "ocrModel",
    "currency",
    "units"
  ],
  "properties": {
    "id": {
      "type": "string",
      "pattern": "^[a-z]{2}(-[a-z0-9]+)?$"
    },
    "version": {
      "type": "integer",
      "minimum": 1
    },
    "script": {
      "enum": [
        "LATIN",
        "CYRILLIC"
      ]
    },
    "ocrModel": {
      "type": "string",
      "minLength": 1,
      "description": "Recognition model group: cyrillic or latin."
    },
    "currency": {
      "type": "object",
      "additionalProperties": false,
      "required": [
        "code",
        "symbols"
      ],
      "properties": {
        "code": {
          "type": "string",
          "pattern": "^[A-Z]{3}$"
        },
        "symbols": {
          "type": "array",
          "minItems": 1,
          "items": {
            "type": "string",
            "minLength": 1
          }
        },
        "decimalSeparators": {
          "type": "array",
          "items": {
            "enum": [
              ",",
              "."
            ]
          },
          "default": [
            ",",
            "."
          ]
        }
      }
    },
    "units": {
      "type": "object",
      "minProperties": 1,
      "description": "MeasureUnit code to spellings found on tags.",
      "propertyNames": {
        "enum": [
          "mg",
          "g",
          "kg",
          "lb",
          "ml",
          "cl",
          "l",
          "pc",
          "pair",
          "dozen"
        ]
      },
      "additionalProperties": {
        "type": "array",
        "minItems": 1,
        "items": {
          "type": "string",
          "minLength": 1
        }
      }
    },
    "multipack": {
      "type": "array",
      "items": {
        "type": "string",
        "minLength": 1
      }
    },
    "unitPriceMarkers": {
      "type": "array",
      "items": {
        "type": "string",
        "minLength": 1
      }
    },
    "discountMarkers": {
      "type": "array",
      "items": {
        "type": "string",
        "minLength": 1
      }
    },
    "oldPriceMarkers": {
      "type": "array",
      "items": {
        "type": "string",
        "minLength": 1
      }
    },
    "loyaltyMarkers": {
      "type": "array",
      "items": {
        "type": "string",
        "minLength": 1
      }
    },
    "charFixes": {
      "type": "object",
      "additionalProperties": {
        "type": "string",
        "minLength": 1,
        "maxLength": 1
      }
    },
    "priceHints": {
      "type": "object",
      "additionalProperties": false,
      "properties": {
        "superscriptCents": {
          "type": "boolean",
          "default": true
        }
      }
    },
    "weightedMarkers": {
      "type": "array",
      "items": {
        "type": "string",
        "minLength": 1
      },
      "description": "Phrases meaning the goods are sold by weight and the price is per the printed reference amount."
    },
    "codeMarkers": {
      "type": "array",
      "items": {
        "type": "string",
        "minLength": 1
      },
      "description": "Labels of lines that carry no price, quantity or name: article codes, validity dates, cashback banners."
    },
    "labelWords": {
      "type": "array",
      "items": {
        "type": "string",
        "minLength": 1
      },
      "description": "Service words printed on tags (price labels, the chain's name); a line made only of them is never the product name."
    },
    "multiBuyFrom": {
      "type": "array",
      "items": {
        "type": "string",
        "minLength": 1
      },
      "description": "Words before a count that make the price under them apply from that many items (\"від 3 шт\")."
    },
    "multiBuyUpTo": {
      "type": "array",
      "items": {
        "type": "string",
        "minLength": 1
      },
      "description": "Words before a count that label the regular price next to a multi-buy one (\"до 2 шт\")."
    }
  }
}
