{
  "id": "uk",
  "version": 1,
  "script": "CYRILLIC",
  "ocrModel": "cyrillic",
  "currency": {
    "code": "UAH",
    "symbols": [
      "₴",
      "грн",
      "грн.",
      "гривень",
      "гривні",
      "uah",
      "ррн",
      "ррн.",
      "рпн",
      "рпн.",
      "гри",
      "гон",
      "рон",
      "рп"
    ],
    "decimalSeparators": [
      ",",
      "."
    ]
  },
  "units": {
    "mg": [
      "мг"
    ],
    "g": [
      "г",
      "г.",
      "гр",
      "гр.",
      "грам",
      "грамів",
      "g",
      "gr",
      "р",
      "р.",
      "r"
    ],
    "kg": [
      "кг",
      "кг.",
      "кілограм",
      "kg",
      "kr",
      "кr",
      "kг",
      "μr",
      "μг",
      "кр",
      "k7",
      "к7",
      "к"
    ],
    "ml": [
      "мл",
      "мл.",
      "ml",
      "мn",
      "mn",
      "м",
      "m",
      "мл/"
    ],
    "l": [
      "л",
      "л.",
      "літр",
      "літра",
      "літрів",
      "l",
      "n",
      "п",
      "π"
    ],
    "pc": [
      "шт",
      "шт.",
      "штук",
      "штуки",
      "уп",
      "уп.",
      "набір",
      "наб-р",
      "наб",
      "наб.",
      "набор",
      "лоток",
      "wт",
      "wt",
      "шт/",
      "wy",
      "w7",
      "ш7",
      "на6-р"
    ]
  },
  "multipack": [
    "x",
    "х",
    "×",
    "*",
    "по",
    "пх",
    "nx"
  ],
  "unitPriceMarkers": [
    "ціна за 1 кг",
    "ціна за 100 г",
    "ціна за 1 л",
    "ціна за 100 мл",
    "ціна за кілограм",
    "ціна за літр",
    "за 1 кг",
    "за 100 г",
    "за 1 л",
    "за 100 мл",
    "за кілограм",
    "за літр",
    "за кг",
    "за л",
    "ціна за 1 шт",
    "за 1 шт",
    "ціна за",
    "цена за"
  ],
  "discountMarkers": [
    "акція",
    "знижка",
    "акційна ціна",
    "суперціна",
    "вигідно",
    "розпродаж",
    "економія",
    "зниж"
  ],
  "oldPriceMarkers": [
    "стара ціна",
    "було",
    "звичайна ціна",
    "без картки"
  ],
  "loyaltyMarkers": [
    "з карткою",
    "за карткою",
    "ціна з карткою",
    "для своїх",
    "картка лояльності",
    "додатка атб",
    "додатка",
    "з додатком",
    "в додатку",
    "при оплаті карткою",
    "карткою атб",
    "при оплаті",
    "скануванн",
    "сканувани",
    "атб",
    "касі",
    "карткою",
    "ціна при",
    "цина при"
  ],
  "charFixes": {
    "O": "0",
    "О": "0",
    "о": "0",
    "З": "3",
    "з": "3",
    "l": "1",
    "I": "1",
    "І": "1",
    "і": "1",
    "Б": "6",
    "б": "6",
    "Q": "0",
    "q": "0"
  },
  "priceHints": {
    "superscriptCents": true
  },
  "weightedMarkers": [
    "ваговий",
    "вагов",
    "вартість вказана за",
    "вартисть вказана за",
    "вказана за 100",
    "вказана за",
    "вага",
    "ваг."
  ],
  "codeMarkers": [
    "код:",
    "код ",
    "koд",
    "kод",
    "kod",
    "штрих",
    "кешбек",
    "діє з",
    "дiє з"
  ],
  "labelWords": [
    "ціна",
    "цина",
    "тільки",
    "тилки",
    "тильки",
    "при",
    "npu",
    "npi",
    "на",
    "касі",
    "атб",
    "atb",
    "знижка",
    "npn",
    "національний",
    "україна",
    "кешбек"
  ],
  "multiBuyFrom": [
    "від",
    "вiд",
    "вд",
    "в1д"
  ],
  "multiBuyUpTo": [
    "до"
  ]
}
