{
  "id": "ru",
  "version": 1,
  "script": "CYRILLIC",
  "ocrModel": "cyrillic",
  "currency": {
    "code": "RUB",
    "symbols": [
      "₽",
      "руб",
      "руб.",
      "р.",
      "р",
      "рублей",
      "руб/шт"
    ],
    "decimalSeparators": [
      ",",
      "."
    ]
  },
  "units": {
    "mg": [
      "мг",
      "мг."
    ],
    "g": [
      "г",
      "г.",
      "гр",
      "гр.",
      "грамм",
      "грамма",
      "граммов",
      "g"
    ],
    "kg": [
      "кг",
      "кг.",
      "килограмм",
      "kg"
    ],
    "ml": [
      "мл",
      "мл.",
      "ml"
    ],
    "cl": [
      "сл"
    ],
    "l": [
      "л",
      "л.",
      "литр",
      "литра",
      "литров",
      "l"
    ],
    "pc": [
      "шт",
      "шт.",
      "штук",
      "штуки",
      "штука",
      "уп",
      "уп.",
      "упак",
      "набор",
      "наб",
      "наб."
    ]
  },
  "multipack": [
    "x",
    "х",
    "×",
    "*",
    "по"
  ],
  "unitPriceMarkers": [
    "цена за 1 кг",
    "цена за 100 г",
    "цена за 1 л",
    "цена за 100 мл",
    "цена за килограмм",
    "цена за литр",
    "за 1 кг",
    "за 100 г",
    "за 1 л",
    "за 100 мл",
    "за килограмм",
    "за литр",
    "за кг",
    "за л",
    "цена за 1 шт",
    "за 1 шт",
    "цена за"
  ],
  "discountMarkers": [
    "акция",
    "скидка",
    "спеццена",
    "выгодно",
    "супер цена",
    "суперцена",
    "распродажа",
    "экономия"
  ],
  "oldPriceMarkers": [
    "старая цена",
    "было",
    "обычная цена",
    "без карты"
  ],
  "loyaltyMarkers": [
    "по карте",
    "с картой",
    "клубная цена",
    "карта лояльности",
    "для своих",
    "цена по карте",
    "в приложении",
    "с приложением",
    "по приложению"
  ],
  "charFixes": {
    "O": "0",
    "О": "0",
    "о": "0",
    "З": "3",
    "з": "3",
    "l": "1",
    "I": "1",
    "І": "1",
    "і": "1",
    "Б": "6",
    "б": "6",
    "Q": "0",
    "q": "0"
  },
  "priceHints": {
    "superscriptCents": true
  },
  "weightedMarkers": [
    "весовой",
    "весов",
    "цена указана за 100",
    "стоимость указана за"
  ],
  "codeMarkers": [
    "код:",
    "код ",
    "koд",
    "kод",
    "kod",
    "артикул",
    "штрих",
    "кешбэк",
    "кэшбэк",
    "действует с"
  ],
  "labelWords": [
    "цена",
    "только",
    "при",
    "на",
    "кассе"
  ],
  "multiBuyFrom": [
    "от"
  ],
  "multiBuyUpTo": [
    "до"
  ]
}
